{
  "$schema": "https://raw.githubusercontent.com/UncleFvcker/RoguelikeFansBand-Rewrite/main/schemas/content-v1/player-ability-binding.schema.json",
  "formatVersion": 1,
  "abilityId": "demo.ability.warrens-scare",
  "minimumLevel": 1,
  "resourceId": "demo.resource.mana",
  "resourceCost": 1,
  "baseFailurePercent": 0
}
