{
  "$schema": "https://raw.githubusercontent.com/UncleFvcker/RoguelikeFansBand-Rewrite/main/schemas/content-v1/player-ability-binding.schema.json",
  "formatVersion": 1,
  "abilityId": "demo.ability.death-battle-frenzy",
  "minimumLevel": 30,
  "resourceId": "demo.resource.mana",
  "resourceCost": 25,
  "baseFailurePercent": 75
}
